{
  "$schema": "https://json-schema.org/draft/2020-12/schema",
  "title": "Independent briefing review v1",
  "type": "object",
  "required": [
    "schema_version",
    "reviewer",
    "actor",
    "date_checked",
    "report_sha256",
    "ledger_sha256",
    "coverage",
    "claims",
    "signoff"
  ],
  "properties": {
    "schema_version": {
      "const": 1
    },
    "reviewer": {
      "type": "string",
      "minLength": 1
    },
    "actor": {
      "enum": [
        "human",
        "independent_agent"
      ]
    },
    "date_checked": {
      "anyOf": [
        {
          "type": "string",
          "pattern": "^\\d{4}-\\d{2}-\\d{2}(?:T\\d{2}:\\d{2}(?::\\d{2}(?:\\.\\d{1,6})?)?(?:Z|[+-]\\d{2}:\\d{2})?)?$"
        },
        {
          "type": "null"
        }
      ]
    },
    "report_sha256": {
      "type": "string",
      "pattern": "^[a-f0-9]{64}$"
    },
    "ledger_sha256": {
      "type": "string",
      "pattern": "^[a-f0-9]{64}$"
    },
    "coverage": {
      "type": "object",
      "required": [
        "complete",
        "notes"
      ],
      "properties": {
        "complete": {
          "type": "boolean"
        },
        "notes": {
          "type": "string"
        }
      }
    },
    "claims": {
      "type": "array",
      "items": {
        "type": "object",
        "required": [
          "claim_id",
          "disposition",
          "rationale"
        ],
        "properties": {
          "claim_id": {
            "type": "string",
            "pattern": "^C[0-9]{3,}$"
          },
          "disposition": {
            "enum": [
              "supported",
              "unsupported",
              "unverified"
            ]
          },
          "source_url": {
            "type": "string",
            "format": "uri",
            "pattern": "^https?://"
          },
          "support_quote": {
            "type": "string"
          },
          "anchor": {
            "type": "string"
          },
          "rationale": {
            "type": "string",
            "minLength": 1
          }
        }
      }
    },
    "signoff": {
      "type": "object",
      "required": [
        "reviewer",
        "date",
        "decision"
      ],
      "properties": {
        "reviewer": {
          "type": "string",
          "minLength": 1
        },
        "date": {
          "anyOf": [
            {
              "type": "string",
              "pattern": "^\\d{4}-\\d{2}-\\d{2}(?:T\\d{2}:\\d{2}(?::\\d{2}(?:\\.\\d{1,6})?)?(?:Z|[+-]\\d{2}:\\d{2})?)?$"
            },
            {
              "type": "null"
            }
          ]
        },
        "decision": {
          "enum": [
            "approve",
            "hold",
            "reject"
          ]
        }
      }
    }
  }
}
